{
  "schema_version": "1.0",
  "issue_id": "5",
  "mode": "implementation",
  "verdict": "passed",
  "last_evaluated_at": "2026-05-05T15:05:00Z",
  "evaluator_run_id": null,
  "contract_review": null,
  "implementation_review": {
    "scores": {
      "contract_compliance": 5,
      "operational_stability": 4,
      "quality_ux": 4,
      "edge_cases": 4,
      "no_regressions": 5
    },
    "thresholds_met": true,
    "tdd_verified": true,
    "bugs": [],
    "feedback_ref": "docs/feedback/issue-5.md"
  }
}
