{
  "schema_version": "1.0",
  "issue_id": "1",
  "mode": "implementation",
  "verdict": "passed",
  "last_evaluated_at": "2026-04-29T15:00:00Z",
  "evaluator_run_id": "issue-1-impl-attempt-2",
  "implementation_review": {
    "scores": {
      "contract_compliance": 5,
      "operational_stability": 5,
      "quality_ux": 5,
      "edge_cases": 4,
      "no_regressions": 5
    },
    "thresholds_met": true,
    "tdd_verified": true,
    "bugs": [],
    "feedback_ref": "docs/feedback/issue-1.md"
  }
}
